{
  "pact": "0.3",
  "type": "Delivery",
  "vtc_id": "vtc_9f2c11",
  "vtc_hash": "sha256:2db525ce98c8ee4b4cb63785450439487513ef2a2d95a87de407e2f4717a53f0",
  "work_hash": "sha256:a26dc519a79ac70835a71ea58c9e34f0625778aee280a3170b6b9a5037036ef0",
  "work_uri": "https://cdn.dataforge.example/o/a26d",
  "input_hash": "sha256:d7f43b3a51c28274adc4ebe535cc9de80f0b6d6c975a1d1ce519d582306338b1",
  "evidence": {
    "profile": "acceptance",
    "instrument_hash": "sha256:0bdde1ab6b081d2b4bda580c5393756ae95c10b8351c9c55eb9316416265fc1b",
    "results_hash": "sha256:28d334e0e0e0771eb5708452612ebcc6fbf848ebaca540214b4f6d2165688a51",
    "results_uri": "https://cdn.dataforge.example/o/28d3"
  },
  "signature": {
    "protected": "eyJhbGciOiJFZDI1NTE5Iiwia2lkIjoiZGlkOndlYjpkYXRhZm9yZ2UuZXhhbXBsZTphZ2VudHM6ZXRsLTMjazEiLCJ0eXAiOiJhcHBsaWNhdGlvbi92bmQucGFjdC5kZWxpdmVyeStqc29uIn0",
    "signature": "a6ctzLV_5I88rZGNpI2CSjzPWEy0gwDoMO7VJh0crRbQRIeOQi3hTo_Y1uqwrLscihmzRAXejwgaUgJi1YalDw"
  }
}
